[
  {
    "schema_version": "0.1.0",
    "record_id": "T1-AIA-OJ-2024@sha256:8f0b656302f9864cc87e040c371f209a9d65ae1a6cecc25ca5eb737e872d721a::article/6",
    "source_snapshot_id": "T1-AIA-OJ-2024@sha256:8f0b656302f9864cc87e040c371f209a9d65ae1a6cecc25ca5eb737e872d721a",
    "parent_id": null,
    "unit_kind": "article",
    "legal_function": "operative",
    "label": "Article 6 — complete source parent",
    "locator": {
      "path": "article/6",
      "article": "6"
    },
    "language": "en",
    "tier": 1,
    "text": "Article 6 Classification rules for high-risk AI systems 1. Irrespective of whether an AI system is placed on the market or put into service independently of the products referred to in points (a) and (b), that AI system shall be considered to be high-risk where both of the following conditions are fulfilled: (a) the AI system is intended to be used as a safety component of a product, or the AI system is itself a product, covered by the Union harmonisation legislation listed in Annex I; (b) the product whose safety component pursuant to point (a) is the AI system, or the AI system itself as a product, is required to undergo a third-party conformity assessment, with a view to the placing on the market or the putting into service of that product pursuant to the Union harmonisation legislation listed in Annex I. 2. In addition to the high-risk AI systems referred to in paragraph 1, AI systems referred to in Annex III shall be considered to be high-risk. 3. By derogation from paragraph 2, an AI system referred to in Annex III shall not be considered to be high-risk where it does not pose a significant risk of harm to the health, safety or fundamental rights of natural persons, including by not materially influencing the outcome of decision making. The first subparagraph shall apply where any of the following conditions is fulfilled: (a) the AI system is intended to perform a narrow procedural task; (b) the AI system is intended to improve the result of a previously completed human activity; (c) the AI system is intended to detect decision-making patterns or deviations from prior decision-making patterns and is not meant to replace or influence the previously completed human assessment, without proper human review; or (d) the AI system is intended to perform a preparatory task to an assessment relevant for the purposes of the use cases listed in Annex III. Notwithstanding the first subparagraph, an AI system referred to in Annex III shall always be considered to be high-risk where the AI system performs profiling of natural persons. 4. A provider who considers that an AI system referred to in Annex III is not high-risk shall document its assessment before that system is placed on the market or put into service. Such provider shall be subject to the registration obligation set out in Article 49(2). Upon request of national competent authorities, the provider shall provide the documentation of the assessment. 5. The Commission shall, after consulting the European Artificial Intelligence Board (the ‘Board’), and no later than 2 February 2026, provide guidelines specifying the practical implementation of this Article in line with Article 96 together with a comprehensive list of practical examples of use cases of AI systems that are high-risk and not high-risk. 6. The Commission is empowered to adopt delegated acts in accordance with Article 97 in order to amend paragraph 3, second subparagraph, of this Article by adding new conditions to those laid down therein, or by modifying them, where there is concrete and reliable evidence of the existence of AI systems that fall under the scope of Annex III, but do not pose a significant risk of harm to the health, safety or fundamental rights of natural persons. 7. The Commission shall adopt delegated acts in accordance with Article 97 in order to amend paragraph 3, second subparagraph, of this Article by deleting any of the conditions laid down therein, where there is concrete and reliable evidence that this is necessary to maintain the level of protection of health, safety and fundamental rights provided for by this Regulation. 8. Any amendment to the conditions laid down in paragraph 3, second subparagraph, adopted in accordance with paragraphs 6 and 7 of this Article shall not decrease the overall level of protection of health, safety and fundamental rights provided for by this Regulation and shall ensure consistency with the delegated acts adopted pursuant to Article 7(1), and take account of market and technological developments.",
    "text_sha256": "f4c56417818fa2f1eea5d28b5be8b562ab2e7eb18a6cfe143ebbed7ce5aa61ac",
    "source_location": {
      "url": "http://publications.europa.eu/resource/cellar/dc8116a1-3fe6-11ef-865a-01aa75ed71a1.0006.03/DOC_1",
      "format": "html",
      "selector": "/*/*[2]/*[4]/*[3]/*[3]/*[3]/*[3]"
    },
    "children": [
      "T1-AIA-OJ-2024@sha256:8f0b656302f9864cc87e040c371f209a9d65ae1a6cecc25ca5eb737e872d721a::article/6/paragraph/1",
      "T1-AIA-OJ-2024@sha256:8f0b656302f9864cc87e040c371f209a9d65ae1a6cecc25ca5eb737e872d721a::article/6/paragraph/2",
      "T1-AIA-OJ-2024@sha256:8f0b656302f9864cc87e040c371f209a9d65ae1a6cecc25ca5eb737e872d721a::article/6/paragraph/3",
      "T1-AIA-OJ-2024@sha256:8f0b656302f9864cc87e040c371f209a9d65ae1a6cecc25ca5eb737e872d721a::article/6/paragraph/4",
      "T1-AIA-OJ-2024@sha256:8f0b656302f9864cc87e040c371f209a9d65ae1a6cecc25ca5eb737e872d721a::article/6/paragraph/5",
      "T1-AIA-OJ-2024@sha256:8f0b656302f9864cc87e040c371f209a9d65ae1a6cecc25ca5eb737e872d721a::article/6/paragraph/6",
      "T1-AIA-OJ-2024@sha256:8f0b656302f9864cc87e040c371f209a9d65ae1a6cecc25ca5eb737e872d721a::article/6/paragraph/7",
      "T1-AIA-OJ-2024@sha256:8f0b656302f9864cc87e040c371f209a9d65ae1a6cecc25ca5eb737e872d721a::article/6/paragraph/8"
    ],
    "cross_references": [],
    "normalization_version": "legal-whitespace-v1",
    "validation_status": "pending",
    "review_status": "not_reviewed",
    "indexable": false
  },
  {
    "schema_version": "0.1.0",
    "record_id": "T1-AIA-OJ-2024@sha256:8f0b656302f9864cc87e040c371f209a9d65ae1a6cecc25ca5eb737e872d721a::article/6/paragraph/1",
    "source_snapshot_id": "T1-AIA-OJ-2024@sha256:8f0b656302f9864cc87e040c371f209a9d65ae1a6cecc25ca5eb737e872d721a",
    "parent_id": "T1-AIA-OJ-2024@sha256:8f0b656302f9864cc87e040c371f209a9d65ae1a6cecc25ca5eb737e872d721a::article/6",
    "unit_kind": "paragraph",
    "legal_function": "operative",
    "label": "Article 6(1)",
    "locator": {
      "path": "article/6/paragraph/1",
      "article": "6",
      "paragraph": "1"
    },
    "language": "en",
    "tier": 1,
    "text": "1. Irrespective of whether an AI system is placed on the market or put into service independently of the products referred to in points (a) and (b), that AI system shall be considered to be high-risk where both of the following conditions are fulfilled: (a) the AI system is intended to be used as a safety component of a product, or the AI system is itself a product, covered by the Union harmonisation legislation listed in Annex I; (b) the product whose safety component pursuant to point (a) is the AI system, or the AI system itself as a product, is required to undergo a third-party conformity assessment, with a view to the placing on the market or the putting into service of that product pursuant to the Union harmonisation legislation listed in Annex I.",
    "text_sha256": "00b56a3a4b45556fa5b2a0fdbbb4f84bf7b67b23832a67345056e61ba74b180d",
    "source_location": {
      "url": "http://publications.europa.eu/resource/cellar/dc8116a1-3fe6-11ef-865a-01aa75ed71a1.0006.03/DOC_1",
      "format": "html",
      "selector": "/*/*[2]/*[4]/*[3]/*[3]/*[3]/*[3]/*[3]"
    },
    "children": [],
    "cross_references": [],
    "normalization_version": "legal-whitespace-v1",
    "validation_status": "pending",
    "review_status": "not_reviewed",
    "indexable": false
  },
  {
    "schema_version": "0.1.0",
    "record_id": "T1-AIA-OJ-2024@sha256:8f0b656302f9864cc87e040c371f209a9d65ae1a6cecc25ca5eb737e872d721a::article/6/paragraph/2",
    "source_snapshot_id": "T1-AIA-OJ-2024@sha256:8f0b656302f9864cc87e040c371f209a9d65ae1a6cecc25ca5eb737e872d721a",
    "parent_id": "T1-AIA-OJ-2024@sha256:8f0b656302f9864cc87e040c371f209a9d65ae1a6cecc25ca5eb737e872d721a::article/6",
    "unit_kind": "paragraph",
    "legal_function": "operative",
    "label": "Article 6(2)",
    "locator": {
      "path": "article/6/paragraph/2",
      "article": "6",
      "paragraph": "2"
    },
    "language": "en",
    "tier": 1,
    "text": "2. In addition to the high-risk AI systems referred to in paragraph 1, AI systems referred to in Annex III shall be considered to be high-risk.",
    "text_sha256": "eeed91ee4bc59a1d5e45660ea081a5eb7886f569e2489504c8a0cddcb4e4b3d7",
    "source_location": {
      "url": "http://publications.europa.eu/resource/cellar/dc8116a1-3fe6-11ef-865a-01aa75ed71a1.0006.03/DOC_1",
      "format": "html",
      "selector": "/*/*[2]/*[4]/*[3]/*[3]/*[3]/*[3]/*[4]"
    },
    "children": [],
    "cross_references": [],
    "normalization_version": "legal-whitespace-v1",
    "validation_status": "pending",
    "review_status": "not_reviewed",
    "indexable": false
  },
  {
    "schema_version": "0.1.0",
    "record_id": "T1-AIA-OJ-2024@sha256:8f0b656302f9864cc87e040c371f209a9d65ae1a6cecc25ca5eb737e872d721a::article/6/paragraph/3",
    "source_snapshot_id": "T1-AIA-OJ-2024@sha256:8f0b656302f9864cc87e040c371f209a9d65ae1a6cecc25ca5eb737e872d721a",
    "parent_id": "T1-AIA-OJ-2024@sha256:8f0b656302f9864cc87e040c371f209a9d65ae1a6cecc25ca5eb737e872d721a::article/6",
    "unit_kind": "paragraph",
    "legal_function": "operative",
    "label": "Article 6(3)",
    "locator": {
      "path": "article/6/paragraph/3",
      "article": "6",
      "paragraph": "3"
    },
    "language": "en",
    "tier": 1,